{
  "store": {
    "name": "non ut officia",
    "currency": "GLT",
    "locale": "sw-ID",
    "logoUrl": "https://Mo.qowoxtcfdG+qaNcOt6No",
    "supportEmail": "hopKCsjf@qjRjXJiKlKoLJPjhzIYNzrk.jdfx"
  },
  "payments": {
    "supportedMethods": [
      "credit_card",
      "stripe",
      "paypal",
      "upi"
    ],
    "stripe": {
      "apiKey": "incididunt non aliqua",
      "webhookSecret": "quis"
    }
  },
  "shipping": {
    "rates": [
      {
        "country": "EU",
        "method": "standard",
        "cost": 42182520.56669156,
        "estimatedDays": 17986370
      },
      {
        "country": "AT",
        "method": "standard",
        "cost": 79885925.60107285,
        "estimatedDays": 13593357
      },
      {
        "country": "VX",
        "method": "express",
        "cost": 28055505.517118074
      }
    ],
    "freeOver": 9060768.389653662
  },
  "inventory": {
    "thresholdAlert": 29160184
  },
  "features": {
    "guestCheckout": true
  },
  "analytics": {
    "googleAnalyticsId": "UA-22937548315-15"
  },
  "categories": [
    {
      "id": "Oo0lqLXhLzq",
      "name": "sunt",
      "slug": "sx8n0qd",
      "parentId": null
    },
    {
      "id": "dSLQJQh5D",
      "name": "qui esse amet deserunt",
      "slug": "rxdkln6k",
      "parentId": null
    },
    {
      "id": "UPLI7GDLJav",
      "name": "Excepteur sed magna pariatur commodo",
      "slug": "wt4x6qwb",
      "parentId": "laboris est id"
    },
    {
      "id": "n7_X",
      "name": "enim cillum laboris",
      "slug": "jfu7"
    },
    {
      "id": "rd2w2F5",
      "name": "nisi Excepteur aute tempor",
      "slug": "tq8d85",
      "parentId": null
    },
    {
      "id": "0",
      "name": "consectetur",
      "slug": "tr8buwrh-",
      "parentId": "reprehenderit do eiusmod nisi qui"
    },
    {
      "id": "tD",
      "name": "ullamco aliquip adipisicing dolor",
      "slug": "58c",
      "parentId": "in"
    },
    {
      "id": "v-G3IU8HP",
      "name": "ad dolore officia",
      "slug": "ceau1yt8"
    },
    {
      "id": "ROxWAW7mCco",
      "name": "veniam ipsum deserunt",
      "slug": "-vy96zs7x",
      "parentId": "voluptate eiusmod ullamco"
    },
    {
      "id": "mlb",
      "name": "id Ut deserunt laboris",
      "slug": "503i",
      "parentId": null
    },
    {
      "id": "cnMq79",
      "name": "quis nostrud Ut",
      "slug": "m",
      "parentId": null
    },
    {
      "id": "mjJ4jQsiK",
      "name": "Lorem",
      "slug": "hw247",
      "parentId": "cillum"
    },
    {
      "id": "qY83lz2",
      "name": "irure id esse occaecat voluptate",
      "slug": "j6ml",
      "parentId": "officia ipsum fugiat nisi aute"
    },
    {
      "id": "_vp",
      "name": "dolor dolore amet ea aliqua",
      "slug": "jgwltw",
      "parentId": "irure aliquip"
    },
    {
      "id": "6vNUtAyY",
      "name": "eu Excepteur pariatur id officia",
      "slug": "h68j41zgct",
      "parentId": null
    },
    {
      "id": "X7WfL-",
      "name": "mollit eiusmod sint",
      "slug": "qvlz90elxe",
      "parentId": null
    },
    {
      "id": "12wtpc9Lib",
      "name": "cupidatat sint ullamco",
      "slug": "mp810p1t",
      "parentId": null
    },
    {
      "id": "O7",
      "name": "in",
      "slug": "4",
      "parentId": "tempor deserunt ut"
    },
    {
      "id": "1or-38",
      "name": "Duis voluptate amet non consectetur",
      "slug": "le1mku95g",
      "parentId": "laboris anim culpa eu aliquip"
    },
    {
      "id": "sd8BzhhHU",
      "name": "ea nulla nostrud ut",
      "slug": "1a5o8wil8up",
      "parentId": null
    },
    {
      "id": "LGmiDTWJm",
      "name": "cupidatat dolore nisi",
      "slug": "7yg7h-1nutr",
      "parentId": "occaecat velit eiusmod laborum"
    },
    {
      "id": "ifeT4ct8pL",
      "name": "pariatur",
      "slug": "rbq3osi",
      "parentId": "commodo aliqua aute"
    },
    {
      "id": "j4U",
      "name": "in et ut eiusmod Excepteur",
      "slug": "97hu4nflm",
      "parentId": "ut velit"
    },
    {
      "id": "DuFW8LSiKjY",
      "name": "Ut mollit anim id non",
      "slug": "7p"
    },
    {
      "id": "0P",
      "name": "labore dolor mollit culpa esse",
      "slug": "fy4a-",
      "parentId": "esse occaecat id labore"
    },
    {
      "id": "HX0",
      "name": "ullamco in",
      "slug": "w0j8wwz",
      "parentId": null
    },
    {
      "id": "ZcVLZaMeR",
      "name": "dolor magna ut nisi",
      "slug": "ie91trxg4z1",
      "parentId": "consequat"
    },
    {
      "id": "D-H17",
      "name": "dolor dolore sunt deserunt",
      "slug": "3acbruf"
    },
    {
      "id": "Ms",
      "name": "in",
      "slug": "z"
    },
    {
      "id": "6",
      "name": "ipsum proident enim",
      "slug": "sxanuw0d",
      "parentId": "officia adipisicing Excepteur sit"
    },
    {
      "id": "5rqwlk",
      "name": "eu pariatur labore magna ut",
      "slug": "t",
      "parentId": "dolore"
    },
    {
      "id": "6B",
      "name": "eu",
      "slug": "f9pu",
      "parentId": null
    },
    {
      "id": "Im",
      "name": "Excepteur irure consectetur",
      "slug": "wd4sh",
      "parentId": "sint sit magna cupidatat ea"
    },
    {
      "id": "y8iQ5Ap",
      "name": "dolor aliquip irure dolore ad",
      "slug": "7wpf3296yq",
      "parentId": null
    },
    {
      "id": "x1cgX3",
      "name": "Ut nisi sunt",
      "slug": "x2i",
      "parentId": null
    },
    {
      "id": "Dr_KmSo3M",
      "name": "eiusmod",
      "slug": "ljmri",
      "parentId": "dolor Lorem occaecat est"
    },
    {
      "id": "i-",
      "name": "adipisicing reprehenderit dolor",
      "slug": "j28mf4hp69h"
    },
    {
      "id": "nVrQp9Da0w",
      "name": "ullamco",
      "slug": "ceyxkke"
    },
    {
      "id": "PRko_D",
      "name": "sit in commodo incididunt dolore",
      "slug": "-q1-"
    },
    {
      "id": "KA-vNmzW9",
      "name": "aliquip qui velit officia",
      "slug": "a5"
    },
    {
      "id": "mfHQn",
      "name": "elit cillum",
      "slug": "hu1e0iff"
    },
    {
      "id": "H04cOvp",
      "name": "Lorem aliqua",
      "slug": "ljb2sqbd"
    },
    {
      "id": "MOQx",
      "name": "culpa",
      "slug": "lvm8z",
      "parentId": "dolore sint adipisicing"
    },
    {
      "id": "-pYTBggegG",
      "name": "ex non",
      "slug": "af-ki9std0i"
    },
    {
      "id": "h",
      "name": "veniam exercitation eu",
      "slug": "fxl"
    },
    {
      "id": "3j3XoNBV8e",
      "name": "laborum sed anim culpa non",
      "slug": "3f8v",
      "parentId": "est ullamco commodo"
    },
    {
      "id": "ekF",
      "name": "in tempor sit nostrud",
      "slug": "3ox15wk",
      "parentId": null
    },
    {
      "id": "h3",
      "name": "sit",
      "slug": "1i34",
      "parentId": "in exercitation dolore"
    },
    {
      "id": "4h",
      "name": "anim eiusmod consequat",
      "slug": "w01i6hr2",
      "parentId": null
    },
    {
      "id": "GDvlD",
      "name": "sint in adipisicing",
      "slug": "d1chxq0v",
      "parentId": null
    },
    {
      "id": "fnMY",
      "name": "ex",
      "slug": "n",
      "parentId": null
    },
    {
      "id": "beoZb",
      "name": "occaecat ex",
      "slug": "grg",
      "parentId": "ea adipisicing sunt"
    },
    {
      "id": "goCsql9qR_",
      "name": "dolore anim in",
      "slug": "fgof45r8",
      "parentId": null
    },
    {
      "id": "ZQ",
      "name": "incididunt irure ad nostrud do",
      "slug": "s60c5r8ey",
      "parentId": null
    },
    {
      "id": "IuOrloy943",
      "name": "dolor",
      "slug": "ktzgic-yf0",
      "parentId": null
    },
    {
      "id": "IjAP5BN",
      "name": "veniam est non magna",
      "slug": "4kj",
      "parentId": null
    },
    {
      "id": "RPjVhz",
      "name": "culpa occaecat",
      "slug": "8i2",
      "parentId": null
    },
    {
      "id": "5-Bt",
      "name": "sint consectetur laborum",
      "slug": "2y1c99",
      "parentId": null
    },
    {
      "id": "NPk41",
      "name": "tempor Ut laboris",
      "slug": "882v32brrlj",
      "parentId": null
    },
    {
      "id": "SQRFs",
      "name": "ullamco ea nisi",
      "slug": "qz7",
      "parentId": null
    },
    {
      "id": "r4K",
      "name": "nisi",
      "slug": "2",
      "parentId": "culpa consectetur est nisi"
    },
    {
      "id": "TE8vZoDWosn",
      "name": "anim aliquip dolor dolore",
      "slug": "-hb",
      "parentId": "ipsum cillum dolor"
    },
    {
      "id": "g",
      "name": "ea fugiat cillum consectetur enim",
      "slug": "1dgyug",
      "parentId": "aliqua aliquip voluptate"
    },
    {
      "id": "QNlBo",
      "name": "qui labore proident",
      "slug": "l",
      "parentId": null
    },
    {
      "id": "A",
      "name": "Duis et sint aliquip cillum",
      "slug": "drcaocp0",
      "parentId": null
    },
    {
      "id": "pqb",
      "name": "quis Duis ipsum",
      "slug": "cnznl2g9"
    },
    {
      "id": "kLKH",
      "name": "esse",
      "slug": "ki6",
      "parentId": "eiusmod Excepteur Lorem"
    },
    {
      "id": "By",
      "name": "id et in",
      "slug": "0",
      "parentId": "Duis in ipsum eiusmod"
    },
    {
      "id": "rY7kKMrR-_",
      "name": "nulla",
      "slug": "6qg"
    },
    {
      "id": "9Kfd5mJ",
      "name": "fugiat minim",
      "slug": "azm83lbx8b",
      "parentId": "sint anim"
    },
    {
      "id": "fMVuoIgS",
      "name": "non dolore id quis",
      "slug": "dk",
      "parentId": null
    },
    {
      "id": "b8Mf",
      "name": "veniam cillum et adipisicing dolor",
      "slug": "dulmakld5",
      "parentId": "veniam"
    },
    {
      "id": "xb8bHITVNh",
      "name": "dolor cillum",
      "slug": "ld52z",
      "parentId": null
    },
    {
      "id": "LXp4I",
      "name": "enim incididunt eiusmod",
      "slug": "4q05mss76p"
    },
    {
      "id": "B2GJKnXWj",
      "name": "dolore non in",
      "slug": "jjnqtueu",